{"contract_version":"remediation-closure-v1","issue_id":"ISSUE-1","defect_removal":{"issue_id":"ISSUE-1","proof_id":"proof-1","passed":true},"required_regression_check_ids":["reg-1"],"regression_checks":[{"id":"reg-1","issue_id":"ISSUE-1","passed":true}],"rescan":{"issue_id":"ISSUE-1","clean":true,"finding_issue_ids":[]},"hypotheses":[{"id":"hyp-1","issue_id":"ISSUE-1","patchable":true,"verified":true,"evidence":{"hypothesis_id":"hyp-1","issue_id":"ISSUE-1","passed":true},"candidate_ids":["cand-1"]},{"id":"hyp-2","issue_id":"ISSUE-1","patchable":true,"verified":true,"evidence":{"hypothesis_id":"hyp-2","issue_id":"ISSUE-1","passed":true},"candidate_ids":["cand-2"]}],"impact":{"issue_id":"ISSUE-1","required_evidence_ids":["impact-1"],"evidence":[{"id":"impact-1","issue_id":"ISSUE-1","passed":true}]}}
